{
  "project_id": "ena-promo-ai",
  "phase": "triage",
  "gate": 2,
  "status": "failed",
  "completed": 0,
  "total": 4,
  "eta_sec": null,
  "artifacts_created": [],
  "errors": [
    {
      "stage": "init",
      "message": "Command /triage requires state in [media_analyzed, selects_ready, blueprint_ready, blocked, timeline_drafted, critique_ready, approved, packaged], but current state is \"intent_locked\"",
      "timestamp": "2026-06-18T00:21:44.472Z",
      "retriable": false
    }
  ],
  "started_at": "2026-06-18T00:21:44.407Z",
  "updated_at": "2026-06-18T00:21:44.472Z"
}