{
  "project_id": "togakushi-camp",
  "phase": "triage",
  "gate": 2,
  "status": "completed",
  "completed": 4,
  "total": 4,
  "eta_sec": 0,
  "artifacts_created": [
    "04_plan/selects_candidates.yaml"
  ],
  "errors": [],
  "started_at": "2026-06-17T07:53:14.377Z",
  "updated_at": "2026-06-17T07:53:43.035Z"
}